{
  "provider_call_id": "bench-provider-call:sha256:81b47cb432fab457ff26e49bc9b8a94cb1ade07fa1f38ec02c3f9442a9f7f60f",
  "schema": "studio.bench.provider-call.v1",
  "attempt_id": "bench-attempt:sha256:8f70da579b7ccedbf7c2041418c248f3ff15f7830d98552788687ac1ed996d21",
  "started_at": "2026-07-20T00:17:57.137Z",
  "completed_at": "2026-07-20T00:18:00.559Z",
  "execution_mode": "live_openai",
  "provider": "openai",
  "operation": "audio_translation",
  "endpoint": "https://api.openai.com/v1/audio/translations",
  "method": "POST",
  "requested_model": "whisper-1",
  "host_context_id": "bench-host-context:sha256:053638d7a4414581427f407ae4b57b7bc42d1f5bd43b598727b8fce8cd840686",
  "media": {
    "content_id": "sha256:b1de8455ae1dd9bb4b5c60db30062280b0010b160e26a4217cd7528e6c5d9193",
    "bytes": 742145
  },
  "prompt": {
    "content_id": "sha256:449546fdf0887dbb91e17af2ae238a8157e0d9928830ecd1f433bc8de3cd52d3",
    "bytes": 246,
    "rule_content_id": null
  },
  "request": {
    "content_id": "sha256:9c6939b6f066f4c6b519813e1fbba32568e0155fe290c860f3f37ecdce436e62",
    "bytes": 743022
  },
  "http_status": 200,
  "provider_request_id": "req_26c19bfa56fd490c823d880dd420b4ea",
  "response": {
    "path": "bench/attempts/rule-change-ko-kinship-address-context-provider-authorized-c2-r3-without/provider-response.json",
    "content_id": "sha256:b2a7c0f69affcdabc3d7659b1a751a2cb130995a7c72d12d0a105c9303491d3b",
    "bytes": 6358
  },
  "outcome": "failed",
  "failure_code": "provider_invalid_output",
  "transport_invocations": 1,
  "retries": 0
}
