{
  "provider_call_id": "bench-provider-call:sha256:004a411a366c18e5db5885786f3ebf14b25df6fea59ff7d6b458df1eb4cd2c2d",
  "schema": "studio.bench.provider-call.v1",
  "attempt_id": "bench-attempt:sha256:05e88f8c2e500d2eb8d5497564f795a699a7eaddcc7ba8030e906743ff15c647",
  "started_at": "2026-07-20T00:18:32.509Z",
  "completed_at": "2026-07-20T00:18:36.492Z",
  "execution_mode": "live_openai",
  "provider": "openai",
  "operation": "audio_translation",
  "endpoint": "https://api.openai.com/v1/audio/translations",
  "method": "POST",
  "requested_model": "whisper-1",
  "host_context_id": "bench-host-context:sha256:053638d7a4414581427f407ae4b57b7bc42d1f5bd43b598727b8fce8cd840686",
  "media": {
    "content_id": "sha256:4f60799f8a71c7c6a19d05067eb7b74b74a9d0f2a32000ba6c1e341273c1905f",
    "bytes": 3465772
  },
  "prompt": {
    "content_id": "sha256:449546fdf0887dbb91e17af2ae238a8157e0d9928830ecd1f433bc8de3cd52d3",
    "bytes": 246,
    "rule_content_id": null
  },
  "request": {
    "content_id": "sha256:8763365f2930f8bd61ee3913f768c71243b8e58a957468c39ddf7f729c6a435e",
    "bytes": 3466642
  },
  "http_status": 200,
  "provider_request_id": "req_cf57665b4f844323801354d6f58c9c84",
  "response": {
    "path": "bench/attempts/rule-change-ko-kinship-address-context-provider-authorized-c3-r3-without/provider-response.json",
    "content_id": "sha256:7d94b452e438da9074ebb8f2e21f79e965901dc7142c05eaf3e15c83bb0f7fe6",
    "bytes": 3183
  },
  "outcome": "success",
  "failure_code": null,
  "transport_invocations": 1,
  "retries": 0
}
