{
  "provider_call_id": "bench-provider-call:sha256:a5df74c4ee3a93204cbbba681f39c4bc691ebdc7f7b08b71b62a56848564a314",
  "schema": "studio.bench.provider-call.v1",
  "attempt_id": "bench-attempt:sha256:c18a4785d4bd26f4da3304b8fdb32923d278ce5dea21745405fe7ff95db7ff94",
  "started_at": "2026-07-20T00:17:01.428Z",
  "completed_at": "2026-07-20T00:17:06.942Z",
  "execution_mode": "live_openai",
  "provider": "openai",
  "operation": "audio_translation",
  "endpoint": "https://api.openai.com/v1/audio/translations",
  "method": "POST",
  "requested_model": "whisper-1",
  "host_context_id": "bench-host-context:sha256:053638d7a4414581427f407ae4b57b7bc42d1f5bd43b598727b8fce8cd840686",
  "media": {
    "content_id": "sha256:a0e78a490a27b228713963a5d8f3c992748e1ae3505b53550fd5dd4dfca9e514",
    "bytes": 973872
  },
  "prompt": {
    "content_id": "sha256:449546fdf0887dbb91e17af2ae238a8157e0d9928830ecd1f433bc8de3cd52d3",
    "bytes": 246,
    "rule_content_id": null
  },
  "request": {
    "content_id": "sha256:267e26a37d6d2baf30eacbcbb1bc1fb7f6a0d01056c3eb0dcb40fb13ff800619",
    "bytes": 974749
  },
  "http_status": 200,
  "provider_request_id": "req_acabadec562048f1bf7b2ff34bf656ff",
  "response": {
    "path": "bench/attempts/rule-change-ko-kinship-address-context-provider-authorized-c1-r1-without/provider-response.json",
    "content_id": "sha256:ea671336ebc6bb229ae41371848fdeab650b6f757bafaa42b2a65d8c26867770",
    "bytes": 6422
  },
  "outcome": "success",
  "failure_code": null,
  "transport_invocations": 1,
  "retries": 0
}
