{
  "provider_call_id": "bench-provider-call:sha256:b9d078838d95523c11c51a02b0a246f6ca9271a7e04570d19fc31116e9b15d6e",
  "schema": "studio.bench.provider-call.v1",
  "attempt_id": "bench-attempt:sha256:c592a4559adeb579096398fe424caea87076f54a87fa03875d9c2404c74af4b2",
  "started_at": "2026-07-20T00:17:11.586Z",
  "completed_at": "2026-07-20T00:17:16.656Z",
  "execution_mode": "live_openai",
  "provider": "openai",
  "operation": "audio_translation",
  "endpoint": "https://api.openai.com/v1/audio/translations",
  "method": "POST",
  "requested_model": "whisper-1",
  "host_context_id": "bench-host-context:sha256:053638d7a4414581427f407ae4b57b7bc42d1f5bd43b598727b8fce8cd840686",
  "media": {
    "content_id": "sha256:a0e78a490a27b228713963a5d8f3c992748e1ae3505b53550fd5dd4dfca9e514",
    "bytes": 973872
  },
  "prompt": {
    "content_id": "sha256:449546fdf0887dbb91e17af2ae238a8157e0d9928830ecd1f433bc8de3cd52d3",
    "bytes": 246,
    "rule_content_id": null
  },
  "request": {
    "content_id": "sha256:e8663c4c8c8580ab94801e30db7ad6a95570272c944d3c1639909f500e6bfdc6",
    "bytes": 974749
  },
  "http_status": 200,
  "provider_request_id": "req_df5b3e6a9bcc4eb3a9d9275f241722e3",
  "response": {
    "path": "bench/attempts/rule-change-ko-kinship-address-context-provider-authorized-c1-r2-without/provider-response.json",
    "content_id": "sha256:4196a5c513b82ccd0e12def2497dec0727e6499df6bd18b5253407914bf89d87",
    "bytes": 6422
  },
  "outcome": "success",
  "failure_code": null,
  "transport_invocations": 1,
  "retries": 0
}
